{
  "meta": {
    "name": "Qwen Image",
    "description": "",
    "author": "",
    "version": "1.0.0",
    "engine": "qwen",
    "categories": [
      "generation"
    ],
    "supports_angles": false,
    "supports_next_scene": false,
    "requires_images": false
  },
  "parameters": [
    {
      "name": "positive_prompt",
      "type": "prompt",
      "node_id": "6",
      "input_name": "text",
      "display_name": "Positive Prompt",
      "description": "Positive prompt (what to generate)",
      "default": ""
    },
    {
      "name": "negative_prompt",
      "type": "prompt",
      "node_id": "7",
      "input_name": "text",
      "display_name": "Negative Prompt",
      "description": "Negative prompt (things to avoid)",
      "default": ""
    },
    {
      "name": "steps",
      "type": "integer",
      "node_id": "3",
      "input_name": "steps",
      "display_name": "Sampling Steps",
      "description": "Number of denoising steps",
      "default": 4,
      "constraints": {
        "min": 1,
        "max": 150,
        "step": 1
      }
    },
    {
      "name": "cfg_scale",
      "type": "float",
      "node_id": "3",
      "input_name": "cfg",
      "display_name": "CFG Scale",
      "description": "Classifier-free guidance scale",
      "default": 1.0,
      "constraints": {
        "min": 1.0,
        "max": 20.0,
        "step": 0.5
      }
    },
    {
      "name": "seed",
      "type": "seed",
      "node_id": "3",
      "input_name": "seed",
      "display_name": "Seed",
      "description": "Random seed (-1 for random)",
      "default": 1104019298716952
    },
    {
      "name": "denoise",
      "type": "float",
      "node_id": "3",
      "input_name": "denoise",
      "display_name": "Denoise Strength",
      "description": "Denoising strength (img2img)",
      "default": 1.0,
      "constraints": {
        "min": 0.1,
        "max": 1.0,
        "step": 0.05
      }
    }
  ],
  "loras": [
    {
      "name": "lora_1",
      "display_name": "Qwen\\Image\\Qwen-Image-2512-Lightning-4steps-V1.0-bf16",
      "node_id": "72",
      "strength_inputs": {
        "model": "strength_model",
        "clip": "strength_clip",
        "lora_name": ""
      },
      "compatible_patterns": [],
      "default_enabled": true,
      "default_strength": 1,
      "required": true
    }
  ],
  "inputs": [],
  "workflow": {
    "3": {
      "inputs": {
        "seed": 1104019298716952,
        "steps": 4,
        "cfg": 1,
        "sampler_name": "euler",
        "scheduler": "simple",
        "denoise": 1,
        "model": [
          "66",
          0
        ],
        "positive": [
          "6",
          0
        ],
        "negative": [
          "7",
          0
        ],
        "latent_image": [
          "58",
          0
        ]
      },
      "class_type": "KSampler",
      "_meta": {
        "title": "KSampler"
      }
    },
    "6": {
      "inputs": {
        "text": "\"A vibrant, warm neon-lit street scene in Hong Kong at the afternoon, with a mix of colorful Chinese and English signs glowing brightly. The atmosphere is lively, cinematic, and rain-washed with reflections on the pavement. The colors are vivid, full of pink, blue, red, and green hues. Crowded buildings with overlapping neon signs. 1980s Hong Kong style. Signs include:\n\"\u9f8d\u9cf3\u51b0\u5ba4\" \"\u91d1\u83ef\u71d2\u81d8\" \"HAPPY HAIR\" \"\u9d3b\u904b\u8336\u9910\u5ef3\" \"EASY BAR\" \"\u6c38\u767c\u9b5a\u86cb\u7c89\" \"\u6dfb\u8a18\u7ca5\u9eb5\" \"SUNSHINE MOTEL\" \"\u7f8e\u90fd\u9910\u5ba4\" \"\u5bcc\u8a18\u7cd6\u6c34\" \"\u592a\u5e73\u9928\" \"\u96c5\u82b3\u9aee\u578b\u5c4b\" \"STAR KTV\" \"\u9280\u6cb3\u5a1b\u6a02\u57ce\" \"\u767e\u6a02\u9580\u821e\u5ef3\" \"BUBBLE CAFE\" \"\u842c\u8c6a\u9ebb\u96c0\u9928\" \"CITY LIGHTS BAR\" \"\u745e\u7965\u9999\u71ed\u838a\" \"\u6587\u8a18\u6587\u5177\" \"GOLDEN JADE HOTEL\" \"LOVELY BEAUTY\" \"\u5408\u8208\u767e\u8ca8\" \"\u8208\u65fa\u96fb\u5668\" And the background is warm yellow street and with all stores' lights on.",
        "clip": [
          "38",
          0
        ]
      },
      "class_type": "CLIPTextEncode",
      "_meta": {
        "title": "CLIP Text Encode (Positive Prompt)"
      }
    },
    "7": {
      "inputs": {
        "text": "",
        "clip": [
          "38",
          0
        ]
      },
      "class_type": "CLIPTextEncode",
      "_meta": {
        "title": "CLIP Text Encode (Negative Prompt)"
      }
    },
    "8": {
      "inputs": {
        "samples": [
          "3",
          0
        ],
        "vae": [
          "39",
          0
        ]
      },
      "class_type": "VAEDecode",
      "_meta": {
        "title": "VAE Decode"
      }
    },
    "37": {
      "inputs": {
        "unet_name": "Qwen\\qwen_image_2512_fp8_e4m3fn.safetensors",
        "weight_dtype": "fp8_e4m3fn"
      },
      "class_type": "UNETLoader",
      "_meta": {
        "title": "Load Diffusion Model"
      }
    },
    "38": {
      "inputs": {
        "clip_name": "qwen_2.5_vl_7b_fp8_scaled.safetensors",
        "type": "qwen_image",
        "device": "default"
      },
      "class_type": "CLIPLoader",
      "_meta": {
        "title": "Load CLIP"
      }
    },
    "39": {
      "inputs": {
        "vae_name": "qwen_image_vae.safetensors"
      },
      "class_type": "VAELoader",
      "_meta": {
        "title": "Load VAE"
      }
    },
    "58": {
      "inputs": {
        "width": 1328,
        "height": 1328,
        "batch_size": 1
      },
      "class_type": "EmptySD3LatentImage",
      "_meta": {
        "title": "EmptySD3LatentImage"
      }
    },
    "60": {
      "inputs": {
        "filename_prefix": "ComfyUI",
        "images": [
          "8",
          0
        ]
      },
      "class_type": "SaveImage",
      "_meta": {
        "title": "Save Image"
      }
    },
    "66": {
      "inputs": {
        "shift": 3.1000000000000005,
        "model": [
          "72",
          0
        ]
      },
      "class_type": "ModelSamplingAuraFlow",
      "_meta": {
        "title": "ModelSamplingAuraFlow"
      }
    },
    "72": {
      "inputs": {
        "lora_name": "Qwen\\Image\\Qwen-Image-2512-Lightning-4steps-V1.0-bf16.safetensors",
        "strength_model": 1,
        "model": [
          "75",
          0
        ]
      },
      "class_type": "LoraLoaderModelOnly",
      "_meta": {
        "title": "LoraLoaderModelOnly"
      }
    },
    "74": {
      "inputs": {
        "backend": "inductor",
        "fullgraph": false,
        "mode": "default",
        "dynamic": "auto",
        "compile_transformer_blocks_only": true,
        "dynamo_cache_size_limit": 64,
        "debug_compile_keys": false,
        "model": [
          "37",
          0
        ]
      },
      "class_type": "TorchCompileModelAdvanced",
      "_meta": {
        "title": "TorchCompileModelAdvanced"
      }
    },
    "75": {
      "inputs": {
        "sage_attention": "disabled",
        "allow_compile": false,
        "model": [
          "74",
          0
        ]
      },
      "class_type": "PathchSageAttentionKJ",
      "_meta": {
        "title": "Patch Sage Attention KJ"
      }
    }
  }
}