{
  "meta": {
    "name": "Flux Canny Model",
    "description": "",
    "author": "",
    "version": "1.0.0",
    "engine": "flux",
    "categories": [
      "editing",
      "img2img"
    ],
    "supports_angles": false,
    "supports_next_scene": false,
    "requires_images": true
  },
  "parameters": [
    {
      "name": "positive_prompt",
      "type": "prompt",
      "node_id": "23",
      "input_name": "text",
      "display_name": "Positive Prompt",
      "description": "Positive prompt (what to generate)",
      "default": ""
    },
    {
      "name": "negative_prompt",
      "type": "prompt",
      "node_id": "7",
      "input_name": "text",
      "display_name": "Negative Prompt",
      "description": "Negative prompt (things to avoid)",
      "default": ""
    },
    {
      "name": "steps",
      "type": "integer",
      "node_id": "3",
      "input_name": "steps",
      "display_name": "Sampling Steps",
      "description": "Number of denoising steps",
      "default": 20,
      "constraints": {
        "min": 1,
        "max": 150,
        "step": 1
      }
    },
    {
      "name": "cfg_scale",
      "type": "float",
      "node_id": "3",
      "input_name": "cfg",
      "display_name": "CFG Scale",
      "description": "Classifier-free guidance scale",
      "default": 1.0,
      "constraints": {
        "min": 1.0,
        "max": 10.0,
        "step": 0.5
      }
    },
    {
      "name": "seed",
      "type": "seed",
      "node_id": "3",
      "input_name": "seed",
      "display_name": "Seed",
      "description": "Random seed (-1 for random)",
      "default": 50363905047731
    },
    {
      "name": "denoise",
      "type": "float",
      "node_id": "3",
      "input_name": "denoise",
      "display_name": "Denoise Strength",
      "description": "Denoising strength (img2img)",
      "default": 1.0,
      "constraints": {
        "min": 0.1,
        "max": 1.0,
        "step": 0.05
      }
    }
  ],
  "loras": [],
  "inputs": [
    {
      "name": "reference_image_1",
      "display_name": "Reference Image 1",
      "node_id": "17",
      "input_name": "image",
      "type": "image",
      "required": false,
      "description": "Reference image for node 17"
    }
  ],
  "workflow": {
    "3": {
      "inputs": {
        "seed": 50363905047731,
        "steps": 20,
        "cfg": 1,
        "sampler_name": "euler",
        "scheduler": "normal",
        "denoise": 1,
        "model": [
          "31",
          0
        ],
        "positive": [
          "35",
          0
        ],
        "negative": [
          "35",
          1
        ],
        "latent_image": [
          "35",
          2
        ]
      },
      "class_type": "KSampler",
      "_meta": {
        "title": "KSampler"
      }
    },
    "7": {
      "inputs": {
        "text": "",
        "clip": [
          "34",
          0
        ]
      },
      "class_type": "CLIPTextEncode",
      "_meta": {
        "title": "CLIP Text Encode (Negative Prompt)"
      }
    },
    "8": {
      "inputs": {
        "samples": [
          "3",
          0
        ],
        "vae": [
          "32",
          0
        ]
      },
      "class_type": "VAEDecode",
      "_meta": {
        "title": "VAE Decode"
      }
    },
    "9": {
      "inputs": {
        "filename_prefix": "ComfyUI",
        "images": [
          "8",
          0
        ]
      },
      "class_type": "SaveImage",
      "_meta": {
        "title": "Save Image"
      }
    },
    "17": {
      "inputs": {
        "image": "Monza 2.jpeg"
      },
      "class_type": "LoadImage",
      "_meta": {
        "title": "Load Image"
      }
    },
    "18": {
      "inputs": {
        "low_threshold": 0.15,
        "high_threshold": 0.3,
        "image": [
          "17",
          0
        ]
      },
      "class_type": "Canny",
      "_meta": {
        "title": "Canny"
      }
    },
    "19": {
      "inputs": {
        "images": [
          "18",
          0
        ]
      },
      "class_type": "PreviewImage",
      "_meta": {
        "title": "Preview Image"
      }
    },
    "23": {
      "inputs": {
        "text": "",
        "clip": [
          "34",
          0
        ]
      },
      "class_type": "CLIPTextEncode",
      "_meta": {
        "title": "CLIP Text Encode (Positive Prompt)"
      }
    },
    "26": {
      "inputs": {
        "guidance": 30,
        "conditioning": [
          "23",
          0
        ]
      },
      "class_type": "FluxGuidance",
      "_meta": {
        "title": "FluxGuidance"
      }
    },
    "31": {
      "inputs": {
        "unet_name": "Flux\\flux1-canny-dev.safetensors",
        "weight_dtype": "default"
      },
      "class_type": "UNETLoader",
      "_meta": {
        "title": "Load Diffusion Model"
      }
    },
    "32": {
      "inputs": {
        "vae_name": "ae.safetensors"
      },
      "class_type": "VAELoader",
      "_meta": {
        "title": "Load VAE"
      }
    },
    "34": {
      "inputs": {
        "clip_name1": "clip_l.safetensors",
        "clip_name2": "t5xxl_fp16.safetensors",
        "type": "flux",
        "device": "default"
      },
      "class_type": "DualCLIPLoader",
      "_meta": {
        "title": "DualCLIPLoader"
      }
    },
    "35": {
      "inputs": {
        "positive": [
          "26",
          0
        ],
        "negative": [
          "7",
          0
        ],
        "vae": [
          "32",
          0
        ],
        "pixels": [
          "18",
          0
        ]
      },
      "class_type": "InstructPixToPixConditioning",
      "_meta": {
        "title": "InstructPixToPixConditioning"
      }
    }
  }
}