{
  "meta": {
    "name": "Flux Fill Outpaint",
    "description": "",
    "author": "",
    "version": "1.0.0",
    "engine": "flux",
    "categories": [
      "editing",
      "img2img"
    ],
    "supports_angles": false,
    "supports_next_scene": false,
    "requires_images": true
  },
  "parameters": [
    {
      "name": "positive_prompt",
      "type": "prompt",
      "node_id": "23",
      "input_name": "text",
      "display_name": "Positive Prompt",
      "description": "Positive prompt (what to generate)",
      "default": "beautiful scenery"
    },
    {
      "name": "negative_prompt",
      "type": "prompt",
      "node_id": "7",
      "input_name": "text",
      "display_name": "Negative Prompt",
      "description": "Negative prompt (things to avoid)",
      "default": ""
    },
    {
      "name": "pad_left",
      "type": "integer",
      "node_id": "44",
      "input_name": "left",
      "display_name": "Pad Left",
      "description": "Pixels to add on the left side",
      "default": 400,
      "constraints": {
        "min": 0,
        "max": 2048,
        "step": 8
      }
    },
    {
      "name": "pad_top",
      "type": "integer",
      "node_id": "44",
      "input_name": "top",
      "display_name": "Pad Top",
      "description": "Pixels to add on the top side",
      "default": 400,
      "constraints": {
        "min": 0,
        "max": 2048,
        "step": 8
      }
    },
    {
      "name": "pad_right",
      "type": "integer",
      "node_id": "44",
      "input_name": "right",
      "display_name": "Pad Right",
      "description": "Pixels to add on the right side",
      "default": 400,
      "constraints": {
        "min": 0,
        "max": 2048,
        "step": 8
      }
    },
    {
      "name": "pad_bottom",
      "type": "integer",
      "node_id": "44",
      "input_name": "bottom",
      "display_name": "Pad Bottom",
      "description": "Pixels to add on the bottom side",
      "default": 400,
      "constraints": {
        "min": 0,
        "max": 2048,
        "step": 8
      }
    },
    {
      "name": "feathering",
      "type": "integer",
      "node_id": "44",
      "input_name": "feathering",
      "display_name": "Feathering",
      "description": "Feather/blur the mask edges",
      "default": 24,
      "constraints": {
        "min": 0,
        "max": 256,
        "step": 1
      }
    },
    {
      "name": "steps",
      "type": "integer",
      "node_id": "3",
      "input_name": "steps",
      "display_name": "Sampling Steps",
      "description": "Number of denoising steps",
      "default": 20,
      "constraints": {
        "min": 1,
        "max": 150,
        "step": 1
      }
    },
    {
      "name": "cfg_scale",
      "type": "float",
      "node_id": "3",
      "input_name": "cfg",
      "display_name": "CFG Scale",
      "description": "Classifier-free guidance scale",
      "default": 1.0,
      "constraints": {
        "min": 1.0,
        "max": 20.0,
        "step": 0.5
      }
    },
    {
      "name": "seed",
      "type": "seed",
      "node_id": "3",
      "input_name": "seed",
      "display_name": "Seed",
      "description": "Random seed (-1 for random)",
      "default": 853355349090712
    },
    {
      "name": "denoise",
      "type": "float",
      "node_id": "3",
      "input_name": "denoise",
      "display_name": "Denoise Strength",
      "description": "Denoising strength (img2img)",
      "default": 1.0,
      "constraints": {
        "min": 0.1,
        "max": 1.0,
        "step": 0.05
      }
    }
  ],
  "loras": [],
  "inputs": [
    {
      "name": "reference_image_1",
      "display_name": "Reference Image 1",
      "node_id": "17",
      "input_name": "image",
      "type": "image",
      "required": false,
      "description": "Reference image for node 17"
    }
  ],
  "workflow": {
    "3": {
      "inputs": {
        "seed": 853355349090712,
        "steps": 20,
        "cfg": 1,
        "sampler_name": "euler",
        "scheduler": "normal",
        "denoise": 1,
        "model": [
          "39",
          0
        ],
        "positive": [
          "38",
          0
        ],
        "negative": [
          "38",
          1
        ],
        "latent_image": [
          "38",
          2
        ]
      },
      "class_type": "KSampler",
      "_meta": {
        "title": "KSampler"
      }
    },
    "7": {
      "inputs": {
        "text": "",
        "clip": [
          "34",
          0
        ]
      },
      "class_type": "CLIPTextEncode",
      "_meta": {
        "title": "CLIP Text Encode (Negative Prompt)"
      }
    },
    "8": {
      "inputs": {
        "samples": [
          "3",
          0
        ],
        "vae": [
          "32",
          0
        ]
      },
      "class_type": "VAEDecode",
      "_meta": {
        "title": "VAE Decode"
      }
    },
    "9": {
      "inputs": {
        "filename_prefix": "ComfyUI",
        "images": [
          "8",
          0
        ]
      },
      "class_type": "SaveImage",
      "_meta": {
        "title": "Save Image"
      }
    },
    "17": {
      "inputs": {
        "image": "ComfyUI_00555_.png"
      },
      "class_type": "LoadImage",
      "_meta": {
        "title": "Load Image"
      }
    },
    "23": {
      "inputs": {
        "text": "beautiful scenery",
        "clip": [
          "34",
          0
        ]
      },
      "class_type": "CLIPTextEncode",
      "_meta": {
        "title": "CLIP Text Encode (Positive Prompt)"
      }
    },
    "26": {
      "inputs": {
        "guidance": 30,
        "conditioning": [
          "23",
          0
        ]
      },
      "class_type": "FluxGuidance",
      "_meta": {
        "title": "FluxGuidance"
      }
    },
    "31": {
      "inputs": {
        "unet_name": "Flux\\flux1-fill-dev.safetensors",
        "weight_dtype": "default"
      },
      "class_type": "UNETLoader",
      "_meta": {
        "title": "Load Diffusion Model"
      }
    },
    "32": {
      "inputs": {
        "vae_name": "ae.safetensors"
      },
      "class_type": "VAELoader",
      "_meta": {
        "title": "Load VAE"
      }
    },
    "34": {
      "inputs": {
        "clip_name1": "clip_l.safetensors",
        "clip_name2": "t5xxl_fp16.safetensors",
        "type": "flux",
        "device": "default"
      },
      "class_type": "DualCLIPLoader",
      "_meta": {
        "title": "DualCLIPLoader"
      }
    },
    "38": {
      "inputs": {
        "noise_mask": false,
        "positive": [
          "26",
          0
        ],
        "negative": [
          "7",
          0
        ],
        "vae": [
          "32",
          0
        ],
        "pixels": [
          "44",
          0
        ],
        "mask": [
          "44",
          1
        ]
      },
      "class_type": "InpaintModelConditioning",
      "_meta": {
        "title": "InpaintModelConditioning"
      }
    },
    "39": {
      "inputs": {
        "strength": 1,
        "model": [
          "31",
          0
        ]
      },
      "class_type": "DifferentialDiffusion",
      "_meta": {
        "title": "Differential Diffusion"
      }
    },
    "44": {
      "inputs": {
        "left": 400,
        "top": 0,
        "right": 400,
        "bottom": 400,
        "feathering": 24,
        "image": [
          "17",
          0
        ]
      },
      "class_type": "ImagePadForOutpaint",
      "_meta": {
        "title": "Pad Image for Outpainting"
      }
    }
  }
}